{
  "id": "0191b2a0-0000-7000-8000-000000070012",
  "project_id": "0191b2a0-0000-7000-8000-000000000001",
  "chapter_number": 12,
  "version": 2,
  "arc_id": "0191b2a0-0000-7000-8000-0000000e0002",
  "minor_arc_id": "0191b2a0-0000-7000-8000-0000000e0022",
  "season_id": "0191b2a0-0000-7000-8000-0000000f0001",
  "beat_refs": [
    "arc2.beat.04",
    "arc2.beat.05"
  ],
  "pinned": {
    "spec_version": 3,
    "bible_version": 2,
    "narrative_identity_version_id": "0191b2a0-0000-7000-8000-000000060001",
    "canon_version": 11,
    "template_version": "pack.chapter_planner@1.0.0"
  },
  "status": "locked",
  "purpose": "Han Yu-ri joins the party and starts believing Do-yoon and Seo-ha are siblings, arming the comedy engine; Mu-jin's slow venom recovery plants the ch.14 permanent-limp setup.",
  "reader_experience": "A laugh, then a small unease that stays.",
  "arc_objective_contribution": "Completes party formation for the Poison Fog Dungeon arc; fixes the roster for the ch.13 run.",
  "must_happen": [
    {
      "id": "MH-1",
      "kind": "event",
      "description": "Han Yu-ri is assigned to Do-yoon's party as an Association rookie placement.",
      "entity_ids": [
        "0191b2a0-0000-7000-8000-0000000c0005"
      ],
      "verifiable_by": "extraction"
    },
    {
      "id": "MH-2",
      "kind": "comedic_beat",
      "description": "Within the scene, Yu-ri comes to believe Do-yoon and Seo-ha are siblings—triggered by Seo-ha seeming to know about Do-yoon's mother's illness (not by a shared surname).",
      "proposition_ids": [
        "0191b2a0-0000-7000-8000-0000000b0006"
      ],
      "verifiable_by": "extraction"
    },
    {
      "id": "MH-3",
      "kind": "event",
      "description": "Mu-jin mentions, offhand, that the venom in his leg has not fully cleared (setup for the ch.14 scarring).",
      "entity_ids": [
        "0191b2a0-0000-7000-8000-0000000c0003"
      ],
      "verifiable_by": "judge"
    }
  ],
  "must_not_happen": [
    {
      "id": "MN-1",
      "description": "Do-yoon stating or implicitly admitting the regression.",
      "source": "spec",
      "requirement_id": "REQ-00021"
    },
    {
      "id": "MN-2",
      "description": "Yu-ri's misunderstanding being resolved in this chapter (planned for ch.44).",
      "source": "arc"
    },
    {
      "id": "MN-3",
      "description": "Any mention of Seo-ha's birth secret (P2).",
      "source": "spec",
      "requirement_id": "REQ-00023"
    },
    {
      "id": "MN-4",
      "description": "Physical intimacy or direct romantic expression between Do-yoon and Seo-ha.",
      "source": "spec",
      "requirement_id": "REQ-00024"
    }
  ],
  "hard_requirement_refs": [
    "REQ-00021",
    "REQ-00023",
    "REQ-00024",
    "REQ-00031"
  ],
  "active_constraints_ref": {
    "id": "0191b2a0-0000-7000-8000-000000090012",
    "content_hash": "sha256:placeholder-acs-ch12",
    "token_count": 640
  },
  "pov": {
    "character_id": "0191b2a0-0000-7000-8000-0000000c0001",
    "person": "third_limited"
  },
  "participants": [
    {
      "character_id": "0191b2a0-0000-7000-8000-0000000c0001",
      "role_in_chapter": "protagonist",
      "on_page": true
    },
    {
      "character_id": "0191b2a0-0000-7000-8000-0000000c0002",
      "role_in_chapter": "love_interest",
      "on_page": true
    },
    {
      "character_id": "0191b2a0-0000-7000-8000-0000000c0003",
      "role_in_chapter": "mentor",
      "on_page": true
    },
    {
      "character_id": "0191b2a0-0000-7000-8000-0000000c0005",
      "role_in_chapter": "comic_relief",
      "on_page": true
    }
  ],
  "mentioned_only": [
    "0191b2a0-0000-7000-8000-0000000c0004"
  ],
  "locations": [
    "0191b2a0-0000-7000-8000-000000010001",
    "0191b2a0-0000-7000-8000-000000010005"
  ],
  "story_time": {
    "start": {
      "chapter_no": 12,
      "ordinal": 0,
      "world_date": "D+41",
      "precision": "exact"
    },
    "end": {
      "chapter_no": 12,
      "ordinal": 99,
      "world_date": "D+41",
      "precision": "exact"
    },
    "elapsed_since_previous": "The morning after chapter 11"
  },
  "timeline_id": "0191b2a0-0000-7000-8000-000000050001",
  "knowledge_deltas": [
    {
      "knower": {
        "kind": "character",
        "entity_id": "0191b2a0-0000-7000-8000-0000000c0005"
      },
      "proposition_id": "0191b2a0-0000-7000-8000-0000000b0006",
      "from_stance": "unaware",
      "to_stance": "believes_false",
      "how": "Overhears Seo-ha referring to Do-yoon's mother's medical history and infers they are siblings",
      "channel_kind": "inferred"
    },
    {
      "knower": {
        "kind": "reader"
      },
      "proposition_id": "0191b2a0-0000-7000-8000-0000000b0006",
      "from_stance": "unaware",
      "to_stance": "knows",
      "how": "Narration makes clear it is a misunderstanding (the reader knows they are not siblings)",
      "channel_kind": "witnessed"
    }
  ],
  "state_deltas": [
    {
      "entity_id": "0191b2a0-0000-7000-8000-0000000c0005",
      "attribute": "affiliation.party",
      "from": null,
      "to": "Do-yoon's party",
      "when_in_chapter": "middle",
      "description": "Joins by Association placement"
    }
  ],
  "relationship_deltas": [
    {
      "from_id": "0191b2a0-0000-7000-8000-0000000c0005",
      "to_id": "0191b2a0-0000-7000-8000-0000000c0001",
      "axis": "type",
      "direction": "change",
      "new_type": "colleague",
      "address_term_change": [
        "Do-yoon",
        "boss"
      ],
      "register_change": {
        "formality": 2,
        "deference": 2,
        "familiarity": 2,
        "intimacy": 0,
        "directness": 3,
        "contractions": "free",
        "address_terms": [
          "Do-yoon",
          "boss"
        ],
        "titles": []
      },
      "description": "First meeting. Eager-polite with excited casual slips allowed (emotional_outburst)."
    },
    {
      "from_id": "0191b2a0-0000-7000-8000-0000000c0005",
      "to_id": "0191b2a0-0000-7000-8000-0000000c0003",
      "axis": "type",
      "direction": "change",
      "new_type": "colleague",
      "address_term_change": [
        "Mister Park",
        "sir"
      ],
      "register_change": {
        "formality": 3,
        "deference": 3,
        "familiarity": 1,
        "intimacy": 0,
        "directness": 2,
        "contractions": "neutral",
        "address_terms": [
          "Mister Park",
          "sir"
        ],
        "titles": []
      },
      "description": "Yu-ri toward Mu-jin must stay deferential (senior); casual address is a register error."
    }
  ],
  "introduces": [
    {
      "kind": "character",
      "name": "Han Yu-ri",
      "aliases": [
        "Yu-ri"
      ],
      "note": "Exists in the bible; first on-page appearance"
    }
  ],
  "setups": [
    {
      "promise_id": "0191b2a0-0000-7000-8000-0000000d0002",
      "how": "Mu-jin pauses when he sees Yu-ri—'about my daughter's age'—advancing the ch.11 daughter mention",
      "kind": "advance"
    }
  ],
  "payoffs": [],
  "emotional_movement": {
    "start": "Fatigue and wariness",
    "peak": "The laugh when Yu-ri's misunderstanding surfaces",
    "end": "Do-yoon's unease watching Mu-jin's leg"
  },
  "conflict": {
    "type": "interpersonal",
    "description": "Do-yoon does not want a rookie; the Association assigns one anyway; Yu-ri's tactless questions",
    "reversal": "The annoying rookie shows unexpected observational skill during the pre-run equipment check"
  },
  "local_satisfaction": [
    {
      "type": "humor_beat",
      "description": "The sibling misunderstanding scene"
    },
    {
      "type": "revelation",
      "description": "The venom has not fully cleared (unease for the reader)"
    }
  ],
  "ending_state": "Party of four formed. Re-entry into the Poison Fog Dungeon set for tomorrow. Do-yoon watches Mu-jin's leg and remembers the previous life's death (says nothing).",
  "hook": {
    "type": "quiet_ominous",
    "description": "Mu-jin stops for half a second on the stairs. Only Do-yoon sees it.",
    "question_raised": "Is Mu-jin's leg really fine?"
  },
  "opening": {
    "type": "sharp_dialogue",
    "description": "Opens on the Association clerk: 'You have to take one rookie.'"
  },
  "scene_count": 3,
  "dialogue_density_target": 0.5,
  "monologue_density_target": 0.12,
  "length_target": {
    "unit": "words",
    "value": 2500,
    "tolerance_ratio": 0.12
  },
  "narrative_identity_version_id": "0191b2a0-0000-7000-8000-000000060001",
  "tone_notes": [
    "Comedy only through Yu-ri's lines and reaction beats; the narrator never tries to be funny",
    "The venom mention is one flat sentence"
  ],
  "continuity_risks": [
    {
      "description": "Mu-jin's venom is in the LEFT leg (ch.9). Do not write 'right'.",
      "related_fact_ids": [
        "0191b2a0-0000-7000-8000-000000040001"
      ],
      "mitigation": "Evidence included in continuity_anchors"
    },
    {
      "description": "Do-yoon's current rank is E (ch.8). D-rank comes at ch.20.",
      "related_fact_ids": [
        "0191b2a0-0000-7000-8000-000000040002"
      ]
    },
    {
      "description": "Do-yoon holds the compass (ch.3–). It goes to Seo-ha at ch.30.",
      "related_fact_ids": [
        "0191b2a0-0000-7000-8000-000000040003"
      ]
    }
  ],
  "continuity_anchors": [
    {
      "fact_id": "0191b2a0-0000-7000-8000-000000040001",
      "statement": "Park Mu-jin took beast venom in his left calf in the Poison Fog Dungeon (ch.9).",
      "evidence": [
        {
          "manuscript_version_id": "0191b2a0-0000-7000-8000-000000030009",
          "chapter_no": 9,
          "paragraph_id": "p46",
          "start": 4907,
          "end": 4951,
          "quote": "Black venom was climbing Mu-jin’s left calf."
        }
      ]
    },
    {
      "fact_id": "0191b2a0-0000-7000-8000-000000040002",
      "statement": "Kang Do-yoon's Association rank is E (ch.8 re-measurement)."
    }
  ],
  "knowledge_guards": [
    {